{
  "$schema": "https://json-schema.org/draft/2020-12/schema",
  "$id": "urn:cookiemonster:schedule:1",
  "title": "CookieMonster schedule definition",
  "description": "Model-authored parameters for one schedule. The scheduler validates and persists this definition, and owns all IDs, timestamps, occurrence records and execution state separately.",
  "type": "object",
  "additionalProperties": false,
  "required": ["schemaVersion", "name", "prompt", "target", "schedule"],
  "properties": {
    "schemaVersion": {
      "type": "integer",
      "const": 1
    },
    "name": {
      "type": "string",
      "$ref": "#/$defs/nonBlankString",
      "maxLength": 120,
      "description": "Short display name for the saved schedule. Names are not unique identifiers."
    },
    "prompt": {
      "type": "string",
      "$ref": "#/$defs/nonBlankString",
      "maxLength": 32768,
      "description": "Durable instructions submitted on every occurrence. Include the work, useful output, and any condition for stopping or requesting input. This text is not executable scheduler configuration."
    },
    "execution": {
      "type": "string",
      "const": "while_app_running",
      "default": "while_app_running",
      "description": "Execution requires the CookieMonster app and its local server to be running. This definition cannot request an OS service or cloud runner."
    },
    "enabled": {
      "type": "boolean",
      "default": true,
      "description": "Whether future occurrences may be dispatched. Disabling does not interrupt or remove an already admitted prompt."
    },
    "target": {
      "oneOf": [
        {
          "$ref": "#/$defs/existingSession"
        },
        {
          "$ref": "#/$defs/newSession"
        }
      ]
    },
    "schedule": {
      "oneOf": [
        {
          "$ref": "#/$defs/once"
        },
        {
          "$ref": "#/$defs/interval"
        },
        {
          "$ref": "#/$defs/calendar"
        }
      ]
    },
    "misfire": {
      "description": "Treatment of occurrences missed while the app was unavailable, asleep, or explicitly paused. Never replay a backlog.",
      "default": {
        "type": "catch_up_once",
        "withinMinutes": 60
      },
      "oneOf": [
        {
          "type": "object",
          "additionalProperties": false,
          "required": ["type"],
          "properties": {
            "type": {
              "type": "string",
              "const": "skip"
            }
          }
        },
        {
          "type": "object",
          "additionalProperties": false,
          "required": ["type", "withinMinutes"],
          "properties": {
            "type": {
              "type": "string",
              "const": "catch_up_once"
            },
            "withinMinutes": {
              "type": "integer",
              "minimum": 1,
              "maximum": 1440,
              "description": "Run only the latest missed occurrence when its scheduled instant is no older than this window. Advance past all other missed occurrences."
            }
          }
        }
      ]
    },
    "notification": {
      "type": "string",
      "enum": ["all_runs", "failures_only"],
      "default": "all_runs",
      "description": "Desktop notification policy. Failures-only includes sign-in and approval needs. Every occurrence remains visible in run history regardless of this setting."
    },
    "maxRuns": {
      "type": "integer",
      "minimum": 1,
      "description": "Optional limit on occurrences with an admitted session prompt, including runs that later fail. Retries of the same occurrence do not consume another run; skipped occurrences do not count.",
      "maximum": 10000
    },
    "endsAt": {
      "$ref": "#/$defs/instant",
      "description": "Exclusive end instant. Do not admit work at or after this instant, including catch-up work. This does not interrupt an already admitted prompt."
    }
  },
  "$defs": {
    "nonBlankString": {
      "type": "string",
      "minLength": 1,
      "pattern": "\\S"
    },
    "instant": {
      "type": "string",
      "format": "date-time",
      "pattern": "^[0-9]{4}-(?:0[1-9]|1[0-2])-(?:0[1-9]|[12][0-9]|3[01])T(?:[01][0-9]|2[0-3]):[0-5][0-9]:[0-5][0-9](?:[.][0-9]{1,3})?(?:Z|[+-](?:[01][0-9]|2[0-3]):[0-5][0-9])$",
      "description": "RFC 3339 timestamp with an explicit Z or numeric UTC offset. Validators must assert the date-time format."
    },
    "existingSession": {
      "type": "object",
      "additionalProperties": false,
      "required": ["type", "sessionID"],
      "properties": {
        "type": {
          "type": "string",
          "const": "existing_session"
        },
        "sessionID": {
          "type": "string",
          "pattern": "^ses",
          "description": "Existing session ID on this scheduler's local server. Resolve it before saving. Queue the prompt with delivery=queue; retain that session's location, agent and model."
        }
      }
    },
    "newSession": {
      "type": "object",
      "additionalProperties": false,
      "required": ["type", "directory", "workspace"],
      "properties": {
        "type": {
          "type": "string",
          "const": "new_session"
        },
        "directory": {
          "type": "string",
          "minLength": 1,
          "pattern": "^(?:/|[A-Za-z]:[\\\\/]|\\\\\\\\)",
          "description": "Absolute project directory on the local host: POSIX, Windows drive or UNC path. The scheduler must confirm availability before dispatch."
        },
        "workspace": {
          "oneOf": [
            {
              "type": "object",
              "additionalProperties": false,
              "required": ["type"],
              "properties": {
                "type": {
                  "type": "string",
                  "const": "local"
                }
              }
            },
            {
              "type": "object",
              "additionalProperties": false,
              "required": ["type", "baseRef"],
              "properties": {
                "type": {
                  "type": "string",
                  "const": "worktree"
                },
                "baseRef": {
                  "$ref": "#/$defs/nonBlankString",
                  "description": "Existing Git ref resolved to a commit at dispatch. Create a fresh managed worktree per occurrence without copying uncommitted changes. Treat this as data, never shell command text."
                }
              }
            }
          ]
        },
        "agent": {
          "$ref": "#/$defs/nonBlankString",
          "description": "Agent ID for new sessions. When omitted, capture the selected/default agent when saving the schedule."
        },
        "model": {
          "type": "object",
          "additionalProperties": false,
          "required": ["providerID", "id"],
          "description": "Existing Model.Ref wire shape. When omitted, capture the selected/default model when saving the schedule. Never silently substitute an unavailable explicit model.",
          "properties": {
            "providerID": {
              "$ref": "#/$defs/nonBlankString"
            },
            "id": {
              "$ref": "#/$defs/nonBlankString"
            },
            "variant": {
              "$ref": "#/$defs/nonBlankString"
            }
          }
        }
      }
    },
    "once": {
      "type": "object",
      "additionalProperties": false,
      "required": ["type", "at"],
      "properties": {
        "type": {
          "type": "string",
          "const": "once"
        },
        "at": {
          "$ref": "#/$defs/instant"
        }
      },
      "description": "One occurrence at a fixed instant. Complete the schedule after that occurrence is admitted or permanently skipped."
    },
    "interval": {
      "type": "object",
      "additionalProperties": false,
      "required": ["type", "everyMinutes", "startsAt"],
      "properties": {
        "type": {
          "type": "string",
          "const": "interval"
        },
        "everyMinutes": {
          "type": "integer",
          "minimum": 1,
          "maximum": 525600
        },
        "startsAt": {
          "$ref": "#/$defs/instant"
        }
      },
      "description": "Occurrences at startsAt + n * everyMinutes for n >= 0. The anchor never resets on completion, restart or pause; intervals use elapsed time rather than local wall time."
    },
    "calendar": {
      "type": "object",
      "additionalProperties": false,
      "required": ["type", "timezone", "time", "weekdays"],
      "properties": {
        "type": {
          "type": "string",
          "const": "calendar"
        },
        "timezone": {
          "type": "string",
          "$ref": "#/$defs/nonBlankString",
          "maxLength": 128,
          "description": "IANA timezone such as Africa/Johannesburg, Europe/London or UTC. Runtime validation must reject unknown zones; abbreviations and numeric offsets are not timezone IDs."
        },
        "time": {
          "type": "string",
          "pattern": "^(?:[01][0-9]|2[0-3]):[0-5][0-9]$",
          "description": "Local wall-clock time in HH:mm, using the selected timezone."
        },
        "weekdays": {
          "type": "array",
          "minItems": 1,
          "maxItems": 7,
          "uniqueItems": true,
          "items": {
            "type": "string",
            "enum": ["mon", "tue", "wed", "thu", "fri", "sat", "sun"]
          },
          "description": "Local weekdays on which to run. Select all seven for a daily schedule."
        }
      },
      "description": "One occurrence on each selected local day. Skip a nonexistent DST time; use the first instant of a repeated DST time and dispatch only once."
    }
  }
}
